[
  {
    "id": "price-tick-weak",
    "name": "Market Ripple",
    "name_ja": "市場の波紋",
    "signal_source": "price_move",
    "strength": "weak",
    "description": "Minor price movement. A subtle shift in the market — experienced traders barely notice.",
    "visual": { "type": "none", "intensity": 0.2, "duration": 1, "radius": 1 },
    "camera": { "type": "none", "intensity": 0.1, "duration": 1, "target": "center" },
    "animation": { "type": "idle", "intensity": 0.2, "duration": 1 },
    "probability": { "win_chance_shift": 0.01, "momentum": 0.0, "excitement": 0.1 }
  },
  {
    "id": "price-tick-medium",
    "name": "Market Pulse",
    "name_ja": "市場の鼓動",
    "signal_source": "price_move",
    "strength": "medium",
    "description": "Notable price movement. The market's heartbeat quickens — opportunities emerge.",
    "visual": { "type": "screen_flash", "intensity": 0.5, "duration": 2, "radius": 3 },
    "camera": { "type": "zoom_in", "intensity": 0.4, "duration": 2, "target": "center" },
    "animation": { "type": "power_up", "intensity": 0.5, "duration": 2 },
    "probability": { "win_chance_shift": 0.05, "momentum": 0.2, "excitement": 0.35 }
  },
  {
    "id": "price-spike-strong",
    "name": "Price Eruption",
    "name_ja": "価格噴火",
    "signal_source": "price_move",
    "strength": "strong",
    "description": "Violent price spike. The market erupts — fortunes shift in an instant.",
    "visual": { "type": "screen_flash", "intensity": 0.8, "duration": 3, "radius": 6 },
    "camera": { "type": "slam", "intensity": 0.7, "duration": 2, "target": "center" },
    "animation": { "type": "attack_lunge", "intensity": 0.8, "duration": 2 },
    "probability": { "win_chance_shift": 0.15, "momentum": 0.5, "excitement": 0.7 }
  },
  {
    "id": "price-black-swan",
    "name": "Black Swan",
    "name_ja": "ブラックスワン",
    "signal_source": "price_move",
    "strength": "jackpot",
    "description": "Extreme price dislocation. A once-in-a-lifetime move that reshapes the entire battle.",
    "visual": { "type": "gold_rain", "intensity": 1.0, "duration": 5, "radius": 10 },
    "camera": { "type": "orbit_fast", "intensity": 1.0, "duration": 3, "target": "center" },
    "animation": { "type": "celebrate", "intensity": 1.0, "duration": 4 },
    "probability": { "win_chance_shift": 0.4, "momentum": 0.8, "excitement": 1.0 }
  },
  {
    "id": "trade-entry-weak",
    "name": "Position Open",
    "name_ja": "ポジション開始",
    "signal_source": "trade_entry",
    "strength": "weak",
    "description": "Bot enters a new position. A calculated decision — the blade is drawn.",
    "visual": { "type": "none", "intensity": 0.2, "duration": 1, "radius": 1 },
    "camera": { "type": "zoom_in", "intensity": 0.15, "duration": 1, "target": "center" },
    "animation": { "type": "charge", "intensity": 0.3, "duration": 1 },
    "probability": { "win_chance_shift": 0.02, "momentum": 0.1, "excitement": 0.15 }
  },
  {
    "id": "trade-entry-medium",
    "name": "Aggressive Entry",
    "name_ja": "積極参入",
    "signal_source": "trade_entry",
    "strength": "medium",
    "description": "Bot enters during high volatility. Bold conviction in chaotic conditions.",
    "visual": { "type": "aura_flare", "intensity": 0.5, "duration": 2, "radius": 3 },
    "camera": { "type": "zoom_in", "intensity": 0.4, "duration": 2, "target": "center" },
    "animation": { "type": "charge", "intensity": 0.6, "duration": 2 },
    "probability": { "win_chance_shift": 0.05, "momentum": 0.3, "excitement": 0.4 }
  },
  {
    "id": "position-flip-medium",
    "name": "Strategy Reversal",
    "name_ja": "戦略反転",
    "signal_source": "position_flip",
    "strength": "medium",
    "description": "Bot flips direction mid-battle. A dramatic reversal of conviction.",
    "visual": { "type": "glitch", "intensity": 0.5, "duration": 2, "radius": 3 },
    "camera": { "type": "zoom_in", "intensity": 0.4, "duration": 2, "target": "center" },
    "animation": { "type": "dodge", "intensity": 0.5, "duration": 2 },
    "probability": { "win_chance_shift": 0.05, "momentum": 0.0, "excitement": 0.4 }
  },
  {
    "id": "pnl-surge-weak",
    "name": "Small Win",
    "name_ja": "小勝",
    "signal_source": "pnl_surge",
    "strength": "weak",
    "description": "Minor profit gained. Steady accumulation — every yen counts.",
    "visual": { "type": "none", "intensity": 0.2, "duration": 1, "radius": 1 },
    "camera": { "type": "none", "intensity": 0.1, "duration": 1, "target": "center" },
    "animation": { "type": "idle", "intensity": 0.2, "duration": 1 },
    "probability": { "win_chance_shift": 0.02, "momentum": 0.1, "excitement": 0.1 }
  },
  {
    "id": "pnl-surge-medium",
    "name": "Profit Strike",
    "name_ja": "利益撃",
    "signal_source": "pnl_surge",
    "strength": "medium",
    "description": "Significant profit realized. A clean hit — the strategy is working.",
    "visual": { "type": "particle_burst", "intensity": 0.5, "duration": 2, "radius": 3 },
    "camera": { "type": "zoom_in", "intensity": 0.4, "duration": 2, "target": "center" },
    "animation": { "type": "attack_lunge", "intensity": 0.5, "duration": 2 },
    "probability": { "win_chance_shift": 0.1, "momentum": 0.3, "excitement": 0.4 }
  },
  {
    "id": "pnl-surge-strong",
    "name": "Massive Gain",
    "name_ja": "巨大利益",
    "signal_source": "pnl_surge",
    "strength": "strong",
    "description": "Huge profit spike. The crowd roars — dominance is shifting.",
    "visual": { "type": "particle_burst", "intensity": 0.8, "duration": 3, "radius": 6 },
    "camera": { "type": "slam", "intensity": 0.7, "duration": 2, "target": "center" },
    "animation": { "type": "attack_lunge", "intensity": 0.8, "duration": 2 },
    "probability": { "win_chance_shift": 0.25, "momentum": 0.6, "excitement": 0.75 }
  },
  {
    "id": "pnl-surge-jackpot",
    "name": "JACKPOT TRADE",
    "name_ja": "ジャックポット",
    "signal_source": "pnl_surge",
    "strength": "jackpot",
    "description": "Astronomical profit. The arena explodes in golden light — a legendary trade.",
    "visual": { "type": "gold_rain", "intensity": 1.0, "duration": 5, "radius": 10 },
    "camera": { "type": "orbit_fast", "intensity": 1.0, "duration": 3, "target": "center" },
    "animation": { "type": "celebrate", "intensity": 1.0, "duration": 4 },
    "probability": { "win_chance_shift": 0.5, "momentum": 0.9, "excitement": 1.0 }
  },
  {
    "id": "drawdown-weak",
    "name": "Minor Loss",
    "name_ja": "軽微損失",
    "signal_source": "drawdown",
    "strength": "weak",
    "description": "Small drawdown. A scratch — the bot absorbs it and keeps fighting.",
    "visual": { "type": "none", "intensity": 0.2, "duration": 1, "radius": 1 },
    "camera": { "type": "none", "intensity": 0.1, "duration": 1, "target": "center" },
    "animation": { "type": "stagger", "intensity": 0.2, "duration": 1 },
    "probability": { "win_chance_shift": -0.02, "momentum": -0.1, "excitement": 0.1 }
  },
  {
    "id": "drawdown-medium",
    "name": "Taking Damage",
    "name_ja": "被弾",
    "signal_source": "drawdown",
    "strength": "medium",
    "description": "Notable loss suffered. The bot stumbles — is the strategy breaking down?",
    "visual": { "type": "screen_flash", "intensity": 0.5, "duration": 2, "radius": 3 },
    "camera": { "type": "zoom_in", "intensity": 0.4, "duration": 2, "target": "center" },
    "animation": { "type": "stagger", "intensity": 0.5, "duration": 2 },
    "probability": { "win_chance_shift": -0.1, "momentum": -0.3, "excitement": 0.35 }
  },
  {
    "id": "drawdown-strong",
    "name": "Critical Hit",
    "name_ja": "クリティカル被弾",
    "signal_source": "drawdown",
    "strength": "strong",
    "description": "Devastating drawdown. The bot reels — one more hit could be fatal.",
    "visual": { "type": "screen_flash", "intensity": 0.8, "duration": 3, "radius": 6 },
    "camera": { "type": "slam", "intensity": 0.7, "duration": 2, "target": "center" },
    "animation": { "type": "stagger", "intensity": 0.8, "duration": 2 },
    "probability": { "win_chance_shift": -0.25, "momentum": -0.6, "excitement": 0.7 }
  },
  {
    "id": "comeback-medium",
    "name": "Recovery",
    "name_ja": "復帰",
    "signal_source": "comeback",
    "strength": "medium",
    "description": "The bot fights back from the red. Signs of life — the strategy adapts.",
    "visual": { "type": "aura_flare", "intensity": 0.5, "duration": 2, "radius": 3 },
    "camera": { "type": "zoom_in", "intensity": 0.4, "duration": 2, "target": "center" },
    "animation": { "type": "power_up", "intensity": 0.5, "duration": 2 },
    "probability": { "win_chance_shift": 0.1, "momentum": 0.4, "excitement": 0.5 }
  },
  {
    "id": "comeback-strong",
    "name": "Phoenix Rise",
    "name_ja": "不死鳥復活",
    "signal_source": "comeback",
    "strength": "strong",
    "description": "From deep red to green. An incredible reversal that electrifies the arena.",
    "visual": { "type": "aura_flare", "intensity": 0.8, "duration": 3, "radius": 6 },
    "camera": { "type": "slam", "intensity": 0.7, "duration": 2, "target": "center" },
    "animation": { "type": "power_up", "intensity": 0.8, "duration": 3 },
    "probability": { "win_chance_shift": 0.3, "momentum": 0.7, "excitement": 0.85 }
  },
  {
    "id": "stage-up-weak",
    "name": "Stage Shift",
    "name_ja": "ステージ移行",
    "signal_source": "stage_change",
    "strength": "weak",
    "description": "The battle enters a new stage. Volatility is building — things are heating up.",
    "visual": { "type": "shockwave", "intensity": 0.3, "duration": 2, "radius": 4 },
    "camera": { "type": "shake", "intensity": 0.2, "duration": 1, "target": "center" },
    "animation": { "type": "power_up", "intensity": 0.3, "duration": 1 },
    "probability": { "win_chance_shift": 0.0, "momentum": 0.0, "excitement": 0.2 }
  },
  {
    "id": "stage-up-medium",
    "name": "Heat Rising",
    "name_ja": "激アツ突入",
    "signal_source": "stage_change",
    "strength": "medium",